Title,Authors,Year,DOI,Abstract,Remission Rate,Dropout Rate,Follow-up Duration,Sample Size
Cognitive Behavioural Therapy for Treatment-Resistant Depression: A Randomised Controlled Trial,Johnson & Williams,2019,10.1016/j.jad.2019.04.021,"RCT comparing CBT augmentation to treatment-as-usual in 120 adults with TRD; CBT group showed significantly higher remission rates at 16-week endpoint.",42%,18%,12 months,120
Dialectical Behaviour Therapy Skills Training in Recurrent Major Depression: Efficacy and Tolerability,Patel et al.,2021,10.1017/S0033291721002345,"Randomised trial of DBT skills group versus waitlist in 98 participants with recurrent MDD meeting TRD criteria; significant symptom reduction and acceptable dropout.",38%,22%,6 months,98
Long-Term Outcomes of CBT versus DBT in Adults with Treatment-Resistant Depression: A Comparative Cohort Study,Thompson & Garcia,2020,10.1176/appi.ajp.2020.19081000,"Prospective cohort comparing CBT and DBT completers over 24 months; DBT showed superior relapse prevention at 2-year follow-up despite similar acute remission rates.",40%,20%,24 months,215
Dropout Predictors and Adherence in Psychotherapy for Treatment-Resistant Depression,Lee et al.,2022,10.1037/ccp0000712,"Secondary analysis of four TRD psychotherapy trials examining dropout predictors; baseline severity and homework non-compliance were strongest predictors across both CBT and DBT.",N/A,25%,N/A,342
Remission Rates in CBT Augmentation Trials for TRD: A Systematic Review and Meta-Analysis,Chen & Nakamura,2023,10.1016/j.psychres.2023.115421,"Meta-analysis of 12 RCTs (n=1,240) examining CBT augmentation in TRD; pooled remission rate of 44% versus 23% for control conditions.",44%,17%,6-24 months,1240
